image,name,description,package,category,price_200,price_200_plus,price_500_plus,price_container,rrp,hit
images/krona-220.png,Сварочный полуавтомат KRONA Expert MIG-220 (No Name),"Cварочный аппарат - 1 шт. Руководство по эксплуатации на русском языке -1 шт. Кабель с горелкой - 2 м. - 1 шт. Кабель с держателем электродов - 1,8 м. - 1 шт. Кабель с клеммой заземления - 1,2 м. -1 шт.",,Сварочные аппараты,2000.00,1800.00,1600.00,1500.00,,no
images/krona 240.png,Сварочный полуавтомат KRONA Expert MIG-240 (No Name),"Cварочный аппарат - 1 шт. Руководство по эксплуатации -1 шт. Кабель с горелкой - 2 м. - 1 шт. Держатель электродов - 1,8 м. - 1 шт. Кабель массы - 1,2 м. - 1 шт. Упаковка - 1 шт. Сварочная проволока в подарок - 1 шт. Руководство по эксплуатации на русском языке - 1 шт.",,Сварочные аппараты,2000.00,1800.00,1600.00,1500.00,,no
,Сварочный полуавтомат KRONA Expert MIG-260 (No Name),"Cварочный аппарат - 1 шт. Руководство по эксплуатации -1 шт. Кабель с горелкой - 3 м. - 1 шт. Держатель электродов - 2,9 м. - 1 шт. Обратный силовой кабель с зажимом (струбциной) - 1,8 м. -1 шт. Сварочная проволока - 1 шт. Газовый шланг - 3 м. - 1 шт. Упаковка - 1 шт.",,Сварочные аппараты,2000.00,1800.00,1600.00,1500.00,,no
,Сварочный полуавтомат KRONA Expert MIG-280 (No Name),,,Сварочные аппараты,2000.00,1800.00,1600.00,1500.00,,no
images/jonser 200qxg.png,Сварочный полуавтомат JONSER 200QXG,"кабель с горелкой -2м кабель с держателем электродов -1.8м кабель с клеммой заземления - 1.2м Флюсовая проволока 1,0 мм Газовый шланг - 3 м хомуты для шланга - 2 шт V-образный ролик - 1 шт наконечник MIG 0,8 мм - 1 шт наконечник MIG 1,0 мм - 1 шт",,Сварочные аппараты,2000.00,1800.00,1600.00,1500.00,,no
images/Бензокоса-HANTEL-HGT-4000-PRO.png,Бензиновый триммер HANTEL HGT-4000 PRO,Триммер бензиновый - 1 шт. Нож 3Т - 1 шт. Нож 40Т - 1шт. Катушка под леску - 1 шт. Защитный кожух - 1 шт. Емкость для топливной смеси - 1 шт. Наплечный ремень - 1 шт. Набор инструментов - 1 шт. Руководство по эксплуатации - 1 шт.,,Триммеры бензиновые,2000.00,1800.00,1600.00,1500.00,,no
images/Бензиновый триммер HANTEL HGT-6500.png,Бензиновый триммер HANTEL HGT-6500 4T (No Name),Триммер бензиновый - 1 шт. Нож 40Т - 1 шт. Катушка под леску - 1 шт. Наплечный ремень - 1 шт. Складная рукоять - 1 шт. Набор инструментов для сборки - 1 шт. Защитный кожух - 1 шт. Руководство по эксплуатации на руссом языке - 1 шт.,,Триммеры бензиновые,2000.00,1800.00,1600.00,1500.00,,no
,Бензиновый триммер JONSER ES-12500 Power (No Name),Триммер бензиновый - 1 шт Нож 40Т - 1 шт Катушка под леску - 1 шт Наплечный ремень - 1 шт Складная рукоять - 1 шт Защитный кожух - 1 шт Набор инструментов - 1 шт Руководство по эксплуатации - 1 шт,,Триммеры бензиновые,2000.00,1800.00,1600.00,1500.00,,no
,Бензиновый триммер JONSER ES-4500 Ultra,,,Триммеры бензиновые,2000.00,1800.00,1600.00,1500.00,,no
,Бензиновый триммер KRONA KZ-7000 Expert (No Name),Триммер бензиновый - 1 шт. Нож 3Т - 1 шт. Нож 40Т - 2 шт. Катушка под леску - 1 шт. Емкость для топливной смеси - 1 шт. Ранцевый ремень - 1 шт. (Внимание! Для надёжного закрепления ранцевого ремня предварительно рекомендуем правильно заправить лямки в крепление и укрепить узлами) Руководство по эксплуатации - 1 шт. Складная рукоять - 1 шт. Набор инструментов - 1 шт. Защитный кожух - 1 шт.,,Триммеры бензиновые,2000.00,1800.00,1600.00,1500.00,,no
